{
    "$schema": "http://json-schema.org/draft-07/schema#",
    "type": "array",
    "description": "请求体结构定义 - 配置策略",
    "items": {
        "type": "object",
        "required": [
            "accessor",
            "resource",
            "operation"
        ],
        "properties": {
            "accessor": {
                "type": "object",
                "description": "访问者信息",
                "required": [
                    "id",
                    "type"
                ],
                "properties": {
                    "id": {
                        "type": "string"
                    },
                    "type": {
                        "type": "string",
                        "enum": [
                            "user",
                            "department",
                            "group",
                            "role",
                            "app"
                        ]
                    }
                }
            },
            "resource": {
                "type": "object",
                "description": "资源信息",
                "required": [
                    "id",
                    "name",
                    "type"
                ],
                "properties": {
                    "id": {
                        "type": "string"
                    },
                    "name": {
                        "type": "string"
                    },
                    "type": {
                        "type": "string",
                        "description": "资源类型"
                    }
                }
            },
            "operation": {
                "type": "object",
                "description": "操作",
                "required": [
                    "allow",
                    "deny"
                ],
                "properties": {
                    "allow": {
                        "type": "array",
                        "items": {
                            "type": "object",
                            "properties": {
                                "id": {
                                    "type": "string"
                                },
                                "obligations": {
                                    "type": "array",
                                    "items": {
                                        "type": "object",
                                        "required": [
                                            "type_id"
                                        ],
                                        "properties": {
                                            "type_id": {
                                                "type": "string"
                                            },
                                            "id": {
                                                "type": "string"
                                            },
                                            "value": {
                                                "type": "object",
                                                "additionalProperties": true
                                            }
                                        }
                                    }
                                }
                            }
                        }
                    },
                    "deny": {
                        "type": "array",
                        "items": {
                            "type": "object",
                            "properties": {
                                "id": {
                                    "type": "string"
                                }
                            }
                        }
                    }
                }
            },
            "condition": {
                "type": "string",
                "description": "条件"
            },
            "expires_at": {
                "type": "string"
            }
        }
    }
}