[
    {
        "expires_at": "1970-01-01T08:00:00+08:00",
        "resource": {
            "id": "*",
            "type": "data_flow",
            "name": "数据流"
        },
        "accessor": {
            "id": "00990824-4bf7-11f0-8fa7-865d5643e61f",
            "type": "role",
            "name": "数据管理员"
        },
        "operation": {
            "allow": [
                {
                    "id": "list"
                },
                {
                    "id": "create"
                },
                {
                    "id": "modify"
                },
                {
                    "id": "delete"
                },
                {
                    "id": "view"
                },
                {
                    "id": "manual_exec"
                },
                {
                    "id": "run_statistics"
                },
                {
                    "id": "run_with_app"
                }
            ],
            "deny": []
        }
    },
    {
        "expires_at": "1970-01-01T08:00:00+08:00",
        "resource": {
            "id": "dataflow_page:o11y",
            "type": "data_flow",
            "name": "数据流"
        },
        "accessor": {
            "id": "00990824-4bf7-11f0-8fa7-865d5643e61f",
            "type": "role",
            "name": "数据管理员"
        },
        "operation": {
            "allow": [
                {
                    "id": "display"
                }
            ],
            "deny": []
        }
    },
    {
        "expires_at": "1970-01-01T08:00:00+08:00",
        "resource": {
            "id": "dataflow_page:o11y",
            "type": "data_flow",
            "name": "数据流"
        },
        "accessor": {
            "id": "3fb94948-5169-11f0-b662-3a7bdba2913f",
            "type": "role",
            "name": "AI管理员"
        },
        "operation": {
            "allow": [
                {
                    "id": "display"
                }
            ],
            "deny": []
        }
    },
    {
        "expires_at": "1970-01-01T08:00:00+08:00",
        "resource": {
            "id": "*",
            "type": "data_flow",
            "name": "数据流"
        },
        "accessor": {
            "id": "3fb94948-5169-11f0-b662-3a7bdba2913f",
            "type": "role",
            "name": "AI管理员"
        },
        "operation": {
            "allow": [
                {
                    "id": "create"
                }
            ],
            "deny": []
        }
    },
    {
        "expires_at": "1970-01-01T08:00:00+08:00",
        "resource": {
            "id": "dataflow_page:o11y",
            "type": "data_flow",
            "name": "数据流"
        },
        "accessor": {
            "id": "1572fb82-526f-11f0-bde6-e674ec8dde71",
            "type": "role",
            "name": "应用管理员"
        },
        "operation": {
            "allow": [
                {
                    "id": "display"
                }
            ],
            "deny": []
        }
    },
    {
        "expires_at": "1970-01-01T08:00:00+08:00",
        "resource": {
            "id": "*",
            "type": "data_flow",
            "name": "数据流"
        },
        "accessor": {
            "id": "1572fb82-526f-11f0-bde6-e674ec8dde71",
            "type": "role",
            "name": "应用管理员"
        },
        "operation": {
            "allow": [
                {
                    "id": "create"
                }
            ],
            "deny": []
        }
    },
    {
        "expires_at": "1970-01-01T08:00:00+08:00",
        "resource": {
            "id": "*",
            "type": "operator",
            "name": "算子"
        },
        "accessor": {
            "id": "3fb94948-5169-11f0-b662-3a7bdba2913f",
            "type": "role",
            "name": "AI管理员"
        },
        "operation": {
            "allow": [
                {
                    "id": "create"
                },
                {
                    "id": "modify"
                },
                {
                    "id": "delete"
                },
                {
                    "id": "view"
                },
                {
                    "id": "publish"
                },
                {
                    "id": "unpublish"
                },
                {
                    "id": "authorize"
                },
                {
                    "id": "public_access"
                },
                {
                    "id": "execute"
                }
            ],
            "deny": []
        }
    },
    {
        "expires_at": "1970-01-01T08:00:00+08:00",
        "resource": {
            "id": "*",
            "type": "tool_box",
            "name": "工具箱"
        },
        "accessor": {
            "id": "3fb94948-5169-11f0-b662-3a7bdba2913f",
            "type": "role",
            "name": "AI管理员"
        },
        "operation": {
            "allow": [
                {
                    "id": "create"
                },
                {
                    "id": "modify"
                },
                {
                    "id": "delete"
                },
                {
                    "id": "view"
                },
                {
                    "id": "publish"
                },
                {
                    "id": "unpublish"
                },
                {
                    "id": "authorize"
                },
                {
                    "id": "public_access"
                },
                {
                    "id": "execute"
                }
            ],
            "deny": []
        }
    },
    {
        "expires_at": "1970-01-01T08:00:00+08:00",
        "resource": {
            "id": "*",
            "type": "mcp",
            "name": "mcp"
        },
        "accessor": {
            "id": "3fb94948-5169-11f0-b662-3a7bdba2913f",
            "type": "role",
            "name": "AI管理员"
        },
        "operation": {
            "allow": [
                {
                    "id": "create"
                },
                {
                    "id": "modify"
                },
                {
                    "id": "delete"
                },
                {
                    "id": "view"
                },
                {
                    "id": "publish"
                },
                {
                    "id": "unpublish"
                },
                {
                    "id": "authorize"
                },
                {
                    "id": "public_access"
                },
                {
                    "id": "execute"
                }
            ],
            "deny": []
        }
    },
    {
        "expires_at": "1970-01-01T08:00:00+08:00",
        "resource": {
            "id": "*",
            "type": "operator",
            "name": "算子"
        },
        "accessor": {
            "id": "00990824-4bf7-11f0-8fa7-865d5643e61f",
            "type": "role",
            "name": "数据管理员"
        },
        "operation": {
            "allow": [
                {
                    "id": "create",
                    "name": ""
                }
            ],
            "deny": []
        }
    },
    {
        "expires_at": "1970-01-01T08:00:00+08:00",
        "resource": {
            "id": "*",
            "type": "mcp",
            "name": "mcp"
        },
        "accessor": {
            "id": "00990824-4bf7-11f0-8fa7-865d5643e61f",
            "type": "role",
            "name": "数据管理员"
        },
        "operation": {
            "allow": [
                {
                    "id": "create",
                    "name": ""
                }
            ],
            "deny": []
        }
    },
    {
        "expires_at": "1970-01-01T08:00:00+08:00",
        "resource": {
            "id": "*",
            "type": "tool_box",
            "name": "工具箱"
        },
        "accessor": {
            "id": "00990824-4bf7-11f0-8fa7-865d5643e61f",
            "type": "role",
            "name": "数据管理员"
        },
        "operation": {
            "allow": [
                {
                    "id": "create",
                    "name": ""
                }
            ],
            "deny": []
        }
    },
    {
        "expires_at": "1970-01-01T08:00:00+08:00",
        "resource": {
            "id": "*",
            "type": "mcp",
            "name": "mcp"
        },
        "accessor": {
            "id": "1572fb82-526f-11f0-bde6-e674ec8dde71",
            "type": "role",
            "name": "应用管理员"
        },
        "operation": {
            "allow": [
                {
                    "id": "create",
                    "name": ""
                }
            ],
            "deny": []
        }
    },
    {
        "expires_at": "1970-01-01T08:00:00+08:00",
        "resource": {
            "id": "*",
            "type": "tool_box",
            "name": "工具箱"
        },
        "accessor": {
            "id": "1572fb82-526f-11f0-bde6-e674ec8dde71",
            "type": "role",
            "name": "应用管理员"
        },
        "operation": {
            "allow": [
                {
                    "id": "create",
                    "name": ""
                }
            ],
            "deny": []
        }
    },
    {
        "expires_at": "1970-01-01T08:00:00+08:00",
        "resource": {
            "id": "*",
            "type": "agent",
            "name": "智能体"
        },
        "accessor": {
            "id": "1572fb82-526f-11f0-bde6-e674ec8dde71",
            "type": "role",
            "name": "应用管理员"
        },
        "operation": {
            "allow": [
                {
                    "id": "publish_to_be_skill_agent"
                },
                {
                    "id": "publish_to_be_api_agent"
                },
                {
                    "id": "create_system_agent"
                },
                {